{
  "$schema": "https://json-schema.org/draft/2020-12/schema",
  "$id": "https://utensils.io/mold/schemas/minimax-h3-conformance-manifest-v1.json",
  "title": "Mold MiniMax H3 conformance manifest",
  "type": "object",
  "additionalProperties": false,
  "required": [
    "schema_version",
    "family",
    "numerical_authority",
    "sources",
    "component_indexes",
    "capture_policy",
    "fixture_layers",
    "day_zero_contract",
    "synthetic_fixture"
  ],
  "properties": {
    "schema_version": {
      "const": "mold.minimax-h3.conformance-manifest.v1"
    },
    "family": {
      "const": "minimax-h3"
    },
    "numerical_authority": {
      "type": "object",
      "additionalProperties": false,
      "required": [
        "source_id",
        "precision",
        "oracle_runtime",
        "excluded_accelerations",
        "excluded_acceleration_aliases"
      ],
      "properties": {
        "source_id": { "const": "diffusers" },
        "precision": { "const": "official-bf16-fp32-mixed" },
        "oracle_runtime": { "$ref": "#/$defs/oracle_runtime" },
        "excluded_accelerations": {
          "type": "array",
          "minItems": 7,
          "items": { "type": "string", "minLength": 1 }
        },
        "excluded_acceleration_aliases": {
          "type": "object",
          "additionalProperties": false,
          "required": [
            "torch-compile",
            "fp8",
            "cache-dit",
            "sageattention",
            "stochastic-sampling",
            "approximate-attention",
            "tf32"
          ],
          "properties": {
            "torch-compile": { "$ref": "#/$defs/acceleration_aliases" },
            "fp8": { "$ref": "#/$defs/acceleration_aliases" },
            "cache-dit": { "$ref": "#/$defs/acceleration_aliases" },
            "sageattention": { "$ref": "#/$defs/acceleration_aliases" },
            "stochastic-sampling": {
              "$ref": "#/$defs/acceleration_aliases"
            },
            "approximate-attention": {
              "$ref": "#/$defs/acceleration_aliases"
            },
            "tf32": { "$ref": "#/$defs/acceleration_aliases" }
          }
        }
      }
    },
    "sources": {
      "type": "array",
      "minItems": 8,
      "items": { "$ref": "#/$defs/source" }
    },
    "component_indexes": {
      "type": "array",
      "minItems": 8,
      "items": { "$ref": "#/$defs/component_index" }
    },
    "capture_policy": {
      "type": "object",
      "additionalProperties": false,
      "required": [
        "external_fixture_root_required",
        "authorization_record_required",
        "weights_in_repository_forbidden",
        "generated_media_in_repository_forbidden",
        "authorization_issue",
        "fixture_root_environment",
        "authorization_record_environment"
      ],
      "properties": {
        "external_fixture_root_required": { "type": "boolean" },
        "authorization_record_required": { "type": "boolean" },
        "weights_in_repository_forbidden": { "type": "boolean" },
        "generated_media_in_repository_forbidden": { "type": "boolean" },
        "authorization_issue": {
          "const": "https://github.com/utensils/mold/issues/831"
        },
        "fixture_root_environment": { "const": "MOLD_H3_FIXTURE_ROOT" },
        "authorization_record_environment": {
          "const": "MOLD_H3_AUTHORIZATION_RECORD"
        }
      }
    },
    "fixture_layers": {
      "type": "array",
      "minItems": 12,
      "items": { "$ref": "#/$defs/fixture_layer" }
    },
    "day_zero_contract": {
      "type": "object",
      "additionalProperties": false,
      "required": [
        "fps",
        "frame_step",
        "frame_offset",
        "nominal_15_second_frames",
        "nominal_15_second_actual_duration",
        "mold_decision",
        "diffusers_discrepancy"
      ],
      "properties": {
        "fps": { "const": 24 },
        "frame_step": { "const": 17 },
        "frame_offset": { "const": 5 },
        "nominal_15_second_frames": { "const": 345 },
        "nominal_15_second_actual_duration": { "const": 14.375 },
        "mold_decision": { "const": "cap-at-valid-345" },
        "diffusers_discrepancy": { "const": "aligns-to-362-then-rejects-over-15s" }
      }
    },
    "synthetic_fixture": {
      "type": "object",
      "additionalProperties": false,
      "required": ["relative_path", "sha256", "weights_required"],
      "properties": {
        "relative_path": { "const": "synthetic-v1.json" },
        "sha256": { "$ref": "#/$defs/sha256" },
        "weights_required": { "const": false }
      }
    }
  },
  "$defs": {
    "sha256": {
      "type": "string",
      "pattern": "^[0-9a-f]{64}$"
    },
    "commit": {
      "type": "string",
      "pattern": "^[0-9a-f]{40}$"
    },
    "acceleration_aliases": {
      "type": "array",
      "minItems": 1,
      "items": { "type": "string", "minLength": 1 }
    },
    "oracle_runtime": {
      "type": "object",
      "additionalProperties": false,
      "required": ["python", "torch", "numpy", "cuda", "transformers_revision"],
      "properties": {
        "python": { "type": "string", "minLength": 1 },
        "torch": { "type": "string", "minLength": 1 },
        "numpy": { "type": "string", "minLength": 1 },
        "cuda": { "type": "string", "minLength": 1 },
        "transformers_revision": { "$ref": "#/$defs/commit" }
      }
    },
    "oracle_adapter": {
      "type": "object",
      "additionalProperties": false,
      "required": [
        "id",
        "command_prefix",
        "implementation_path",
        "implementation_sha256"
      ],
      "properties": {
        "id": { "type": "string", "minLength": 1 },
        "command_prefix": { "type": "string", "minLength": 1 },
        "implementation_path": {
          "type": "string",
          "pattern": "^scripts/[a-zA-Z0-9._/-]+\\.py$"
        },
        "implementation_sha256": { "$ref": "#/$defs/sha256" }
      }
    },
    "source": {
      "type": "object",
      "additionalProperties": false,
      "required": ["id", "repository", "revision", "role", "authority"],
      "properties": {
        "id": { "type": "string", "minLength": 1 },
        "repository": { "type": "string", "pattern": "^https://" },
        "revision": { "$ref": "#/$defs/commit" },
        "role": { "type": "string", "minLength": 1 },
        "authority": {
          "enum": ["numerical", "semantic", "deployment", "performance"]
        }
      }
    },
    "component_index": {
      "type": "object",
      "additionalProperties": false,
      "required": ["id", "source_id", "relative_path", "sha256"],
      "properties": {
        "id": { "type": "string", "minLength": 1 },
        "source_id": { "const": "minimax-official-model" },
        "relative_path": { "type": "string", "minLength": 1 },
        "sha256": { "$ref": "#/$defs/sha256" }
      }
    },
    "fixture_layer": {
      "type": "object",
      "additionalProperties": false,
      "required": [
        "id",
        "authority_tier",
        "input_contract",
        "required_component_indexes",
        "required_provenance",
        "pinned_provenance",
        "role_invariant_provenance",
        "required_measurements"
      ],
      "properties": {
        "id": { "type": "string", "minLength": 1 },
        "authority_tier": {
          "enum": [
            "exact-full-bf16",
            "exact-full-fp32",
            "quantized-structural",
            "synthetic"
          ]
        },
        "input_contract": { "$ref": "#/$defs/input_contract" },
        "oracle_adapter": { "$ref": "#/$defs/oracle_adapter" },
        "required_component_indexes": {
          "type": "array",
          "minItems": 1,
          "items": { "type": "string", "minLength": 1 }
        },
        "required_provenance": {
          "type": "array",
          "minItems": 5,
          "items": { "type": "string", "minLength": 1 }
        },
        "pinned_provenance": {
          "type": "array",
          "items": { "$ref": "#/$defs/pinned_provenance" }
        },
        "role_invariant_provenance": {
          "type": "array",
          "minItems": 1,
          "items": { "type": "string", "minLength": 1 }
        },
        "required_measurements": {
          "type": "array",
          "minItems": 2,
          "items": { "type": "string", "minLength": 1 }
        }
      }
    },
    "input_contract": {
      "type": "object",
      "additionalProperties": false,
      "required": ["kind"],
      "properties": {
        "kind": {
          "enum": ["identity-sha256-v1", "canonical-e2e-json-sha256-v1"]
        },
        "task": { "enum": ["t2va", "fl2va", "ref2va"] },
        "algorithm": { "type": "string", "minLength": 1 },
        "guidance": { "type": "string", "minLength": 1 },
        "video_shift": { "type": "string", "minLength": 1 },
        "audio_shift": { "type": "string", "minLength": 1 },
        "dimension_multiple": { "type": "integer", "minimum": 1 },
        "frame_step": { "type": "integer", "minimum": 1 },
        "frame_offset": { "type": "integer", "minimum": 0 },
        "min_frames": { "type": "integer", "minimum": 1 },
        "max_frames": { "type": "integer", "minimum": 1 },
        "max_pixels": { "type": "integer", "minimum": 1 },
        "min_aspect_ratio": { "type": "string", "minLength": 1 },
        "max_aspect_ratio": { "type": "string", "minLength": 1 },
        "fps": { "type": "integer", "minimum": 1 },
        "video_scheduler_component": { "type": "string", "minLength": 1 },
        "audio_scheduler_component": { "type": "string", "minLength": 1 }
      }
    },
    "pinned_provenance": {
      "type": "object",
      "additionalProperties": false,
      "required": ["key", "component_indexes"],
      "properties": {
        "key": { "type": "string", "minLength": 1 },
        "component_indexes": {
          "type": "array",
          "minItems": 1,
          "items": { "type": "string", "minLength": 1 }
        }
      }
    }
  }
}
