{
  "schema_version": "mold.minimax-h3.conformance-manifest.v1",
  "family": "minimax-h3",
  "numerical_authority": {
    "source_id": "diffusers",
    "precision": "official-bf16-fp32-mixed",
    "oracle_runtime": {
      "python": "3.13.13",
      "torch": "2.13.0+cu130",
      "numpy": "2.5.1",
      "cuda": "13.0",
      "transformers_revision": "42f189ded85d18d00b51161d694cafd325e32b91"
    },
    "excluded_accelerations": [
      "torch-compile",
      "fp8",
      "cache-dit",
      "sageattention",
      "stochastic-sampling",
      "approximate-attention",
      "tf32"
    ],
    "excluded_acceleration_aliases": {
      "torch-compile": ["torch-compile", "torch-inductor", "inductor"],
      "fp8": ["fp8", "float8", "e4m3", "e4m3fn", "e5m2"],
      "cache-dit": ["cache-dit"],
      "sageattention": ["sageattention", "sage-attn"],
      "stochastic-sampling": [
        "stochastic-sampling",
        "stochastic",
        "ancestral"
      ],
      "approximate-attention": [
        "approximate-attention",
        "approximate",
        "approx-attn",
        "approx"
      ],
      "tf32": ["tf32", "tensorfloat32"]
    }
  },
  "sources": [
    {
      "id": "minimax-official-code",
      "repository": "https://github.com/MiniMax-AI/MiniMax-H3",
      "revision": "8d8824efaf94586c0cc9ac7ad8d0723d4d6420ea",
      "role": "official architecture and semantic contract",
      "authority": "semantic"
    },
    {
      "id": "minimax-official-model",
      "repository": "https://huggingface.co/MiniMaxAI/MiniMax-H3",
      "revision": "bfc8ed0353f5a9733be73e6b2c98ec0948195b86",
      "role": "official checkpoint configuration and component indexes",
      "authority": "numerical"
    },
    {
      "id": "diffusers",
      "repository": "https://github.com/huggingface/diffusers",
      "revision": "9c6a68c32b3b2a64db91800b624d33cec6e25ab8",
      "role": "official full-precision executable oracle",
      "authority": "numerical"
    },
    {
      "id": "transformers",
      "repository": "https://github.com/huggingface/transformers",
      "revision": "42f189ded85d18d00b51161d694cafd325e32b91",
      "role": "Qwen3-VL tokenizer and multimodal processor authority",
      "authority": "numerical"
    },
    {
      "id": "comfyui",
      "repository": "https://github.com/Comfy-Org/ComfyUI",
      "revision": "a464ac33588ae182f81a090d910cfbf21e255b73",
      "role": "pruned and quantized runtime reference",
      "authority": "deployment"
    },
    {
      "id": "comfy-checkpoints",
      "repository": "https://huggingface.co/Comfy-Org/MiniMax-H3",
      "revision": "eb8a16107c595128b3a578f82d2ce2f75920c355",
      "role": "pruned and quantized checkpoint schema reference",
      "authority": "deployment"
    },
    {
      "id": "nvfp4-checkpoints",
      "repository": "https://huggingface.co/Abiray/Minimax-H3-nvfp4-INT4-INT8-Convrot",
      "revision": "908eccad7e68751190d04c171956f163bfeed741",
      "role": "third-party pruned NVFP4 transformer; downloadable, no runtime arm",
      "authority": "deployment"
    },
    {
      "id": "lightx2v-turbo-adapters",
      "repository": "https://huggingface.co/lightx2v/Minimax-h3-Turbo",
      "revision": "05ef678438e84933c406131b59abbf86919b3aac",
      "role": "third-party Turbo LoRA adapters (v1.1 4-step 768p, v1.0 8-step 768p); runnable on the FL2VA compact stack",
      "authority": "deployment"
    },
    {
      "id": "drbaph-resized-loras",
      "repository": "https://huggingface.co/drbaph/MiniMax-H3-Turbo-Lora-ComfyUI",
      "revision": "be8eb3ea3466cbb7def202ffec0d2fdc054256ac",
      "role": "third-party SVD-resized Turbo LoRA adapters (avg rank 21; lossy); runnable on the compact stacks after the quality gate",
      "authority": "deployment"
    },
    {
      "id": "fasth3-checkpoints",
      "repository": "https://huggingface.co/FastVideo/FastVideo-FastH3-Comfy",
      "revision": "ec1e3aa374a91c57b0b94a1623b7e657c0498cf2",
      "role": "third-party distilled base transformer (FastH3 V2 8-step, INT8 ConvRot); runnable on the FL2VA compact stack",
      "authority": "deployment"
    },
    {
      "id": "kijai-experimental-loras",
      "repository": "https://huggingface.co/Kijai/MiniMax-H3-experimental",
      "revision": "d8023be02fefbb3633b0cd335c3879f91177299d",
      "role": "third-party rank-reduced DMAD 4-step and PDMD 2/4-step distill LoRA adapters (per-module rank, alpha == rank; lossy); runnable on the FL2VA compact stack",
      "authority": "deployment"
    },
    {
      "id": "sglang",
      "repository": "https://github.com/sgl-project/sglang",
      "revision": "0c3a76fa0a5bfab410b645f4143e7e8e3cc25c77",
      "role": "truncated conditioner and distributed performance reference",
      "authority": "performance"
    },
    {
      "id": "vllm-omni",
      "repository": "https://github.com/vllm-project/vllm-omni",
      "revision": "3d7fc3b9ba3cac88d579d4dc35b78b0b641675fc",
      "role": "loader, offload, and CUDA kernel reference",
      "authority": "performance"
    }
  ],
  "component_indexes": [
    {
      "id": "official-license",
      "source_id": "minimax-official-model",
      "relative_path": "LICENSE",
      "sha256": "59b99642b95ea21630e311198ddbfffbfe05aadba0c2f5d884cbdf4efcc90f44"
    },
    {
      "id": "official-model-index",
      "source_id": "minimax-official-model",
      "relative_path": "model_index.json",
      "sha256": "5a587fe13b2371427415ac892463142683aefcd8d322e274a3a095eac37ac7d2"
    },
    {
      "id": "official-modular-index",
      "source_id": "minimax-official-model",
      "relative_path": "modular_model_index.json",
      "sha256": "a2b6a210e482ffb78e613b553f570c44e101afce6741bd4ed91429d0559af031"
    },
    {
      "id": "official-fl2va-transformer-index",
      "source_id": "minimax-official-model",
      "relative_path": "transformer/diffusion_pytorch_model.safetensors.index.json",
      "sha256": "ac30a3b58963f2e735d493475fbb81853a5735ec947619648b3e045acda6783e"
    },
    {
     "id": "official-ref2va-transformer-index",
     "source_id": "minimax-official-model",
     "relative_path": "transformer_ref/diffusion_pytorch_model.safetensors.index.json",
     "sha256": "ac30a3b58963f2e735d493475fbb81853a5735ec947619648b3e045acda6783e"
   },
    {
      "id": "official-fl2va-transformer-config",
      "source_id": "minimax-official-model",
      "relative_path": "transformer/config.json",
      "sha256": "74c11bff524336576096993cbfcdcdc2ef4fa2fa4409df693bdcbc6c666282ae"
    },
    {
      "id": "official-ref2va-transformer-config",
      "source_id": "minimax-official-model",
      "relative_path": "transformer_ref/config.json",
      "sha256": "74c11bff524336576096993cbfcdcdc2ef4fa2fa4409df693bdcbc6c666282ae"
    },
    {
      "id": "official-fl2va-transformer-shard-00001-of-00014",
      "source_id": "minimax-official-model",
      "relative_path": "transformer/diffusion_pytorch_model-00001-of-00014.safetensors",
      "sha256": "2d847200c45c09dd7f973c1b096663068408ef851ee0b3711d059b6dc5dcd028"
    },
    {
      "id": "official-fl2va-transformer-shard-00002-of-00014",
      "source_id": "minimax-official-model",
      "relative_path": "transformer/diffusion_pytorch_model-00002-of-00014.safetensors",
      "sha256": "2c4d362eddd2802180ac9c744849eb9ba8d9c8b984bdf9822cb02ed004b29184"
    },
    {
      "id": "official-fl2va-transformer-shard-00003-of-00014",
      "source_id": "minimax-official-model",
      "relative_path": "transformer/diffusion_pytorch_model-00003-of-00014.safetensors",
      "sha256": "949c5aafbbfa5654da730a6a7fafd75adb164d0857b095a30e8bb6d390887d69"
    },
    {
      "id": "official-fl2va-transformer-shard-00004-of-00014",
      "source_id": "minimax-official-model",
      "relative_path": "transformer/diffusion_pytorch_model-00004-of-00014.safetensors",
      "sha256": "eef7616790105ee839766bb2027203bf2c0d87c6aa038dca84145a8675f5ce28"
    },
    {
      "id": "official-fl2va-transformer-shard-00005-of-00014",
      "source_id": "minimax-official-model",
      "relative_path": "transformer/diffusion_pytorch_model-00005-of-00014.safetensors",
      "sha256": "43fdf42d638e8bc6745f713fae80c93bb301807a1a5ae7249344ce28e202a494"
    },
    {
      "id": "official-fl2va-transformer-shard-00006-of-00014",
      "source_id": "minimax-official-model",
      "relative_path": "transformer/diffusion_pytorch_model-00006-of-00014.safetensors",
      "sha256": "6442510b34d173653f0cce5c964b935395a8f7accf0b9cc0aa31aec59805239d"
    },
    {
      "id": "official-fl2va-transformer-shard-00007-of-00014",
      "source_id": "minimax-official-model",
      "relative_path": "transformer/diffusion_pytorch_model-00007-of-00014.safetensors",
      "sha256": "29f48f535c91dac76496ca821eeb16ca24bc4caf3f0cae8b920a89b1f966da6d"
    },
    {
      "id": "official-fl2va-transformer-shard-00008-of-00014",
      "source_id": "minimax-official-model",
      "relative_path": "transformer/diffusion_pytorch_model-00008-of-00014.safetensors",
      "sha256": "c711b096c764bd60f0b8b6ad49518bfab6d614fb788c725add8741c0674a4cd8"
    },
    {
      "id": "official-fl2va-transformer-shard-00009-of-00014",
      "source_id": "minimax-official-model",
      "relative_path": "transformer/diffusion_pytorch_model-00009-of-00014.safetensors",
      "sha256": "44428defe3976cbb87635ad200b958199e739986697cd29fdf27aeb7294b5944"
    },
    {
      "id": "official-fl2va-transformer-shard-00010-of-00014",
      "source_id": "minimax-official-model",
      "relative_path": "transformer/diffusion_pytorch_model-00010-of-00014.safetensors",
      "sha256": "3d44939c374c9da382e9c6877e1946adf7b84e08c7a881c068f228d6849411c9"
    },
    {
      "id": "official-fl2va-transformer-shard-00011-of-00014",
      "source_id": "minimax-official-model",
      "relative_path": "transformer/diffusion_pytorch_model-00011-of-00014.safetensors",
      "sha256": "224d24430b58127a5577721084e0e704a0e74ec96dd7c35bc6fc0994ebd87c33"
    },
    {